ingredients,directions,image_filename,category_url,title,category,rating,rating_count,cook_time,total_time,yield,servings,calories,fat,carbs,protein,verb_count,ingredient_count,yield_servings_merge,like_or_dislike
"['1 ½ cups rolled oats', '1 ½ cups sifted pastry flour', '1 ⅓ cups packed brown sugar, divided', '¾ teaspoon baking soda', '¼ teaspoon salt', '¾ cup butter, softened', '¾ pound pitted dates, diced', '1 cup water', '1 teaspoon lemon juice']","['Preheat the oven to 350 degrees F (175 degrees C).', 'Combine oats, pastry flour, 1 cup brown sugar, baking soda, and salt in a large bowl. Mix in butter until crumbly. Press half of the mixture into the bottom of a 9-inch square baking pan.', 'Combine dates, water, and remaining 1/3 cup brown sugar in a small saucepan over medium heat. Bring to a boil, and cook until thickened. Stir in lemon juice, and remove from heat. Spread the filling over the base, and spread the remaining crumb mixture on top.', 'Bake in the preheated oven until the top is lightly toasted, 20 to 25 minutes. Cool before cutting into 12 squares.']",7368576-869e126fb14a489bbcb6df6fb3c827f6.jpg,https://www.allrecipes.com/recipes/836/desserts/cookies/bar-cookies/,Gramma's Date Squares,Bar Cookies,4.6,476,25 mins,50 mins,12 squares,12,363,13g,64g,4g,13,9,12,0.0
"['5 ½ cups broccoli florets', '1  carrot, thinly sliced', '2 teaspoons water', '1 teaspoon cornstarch', '1 teaspoon chicken bouillon granules, or to taste', 'salt to taste', '2 tablespoons peanut oil']","['Bring a large pot of lightly salted water to a boil. Add broccoli and cook uncovered until bright green, about 2 minutes. Transfer broccoli to a bowl of ice water using a slotted spoon and immerse for several minutes to stop the cooking process. Drain.', 'Bring water back to a boil in the same large pot; add sliced carrot and cook for 1 minute. Drain.', 'Mix water and cornstarch together in a bowl until smooth. Add chicken granules and salt and mix well.', 'Heat peanut oil in a wok or large skillet over high heat; saute broccoli and carrots for 2 minutes. Add cornstarch mixture; cook and stir until vegetables are coated evenly, 1 to 2 minutes.']",4517666-e5956ccf8b644851931277a07c61e3b5.jpg,https://www.allrecipes.com/recipes/259/main-dish/stir-fry/,Broccoli and Carrot Stir Fry,Stir Fry,4.6,9,16 mins,26 mins,5 cups,5,90,6g,8g,3g,10,7,5,1.0
"['1 cup peanut butter', '½ cup low-calorie natural sweetener (such as Swerve®)', '1  egg', '1 teaspoon sugar-free vanilla extract']","['Gather all ingredients. Preheat the oven to 350 degrees F (175 degrees C). Line a baking sheet with parchment paper.', 'Dotdash Meredith Food Studios', 'Combine peanut butter, sweetener, egg, and vanilla extract in a bowl; mix well until a dough is formed.', 'Dotdash Meredith Food Studios', 'Roll dough into 12 (1-inch) balls. Place on the prepared baking sheet and press down twice with a fork in a criss-cross pattern.', 'Dotdash Meredith Food Studios', 'Bake in the preheated oven until edges are golden, 12 to 15 minutes.', 'Dotdash Meredith Food Studios', 'Cool for 1 minute before transferring to a wire rack to cool completely.', 'Dotdash Meredith Food Studios']",AR-261181-4-ingreddient-keto-peanut-butter-cookies-DDMFS-4x3-0daac4c4889a4bbb88d2459659c016cf.jpg,https://www.allrecipes.com/recipes/22959/healthy-recipes/keto-diet/,4-Ingredient Keto Peanut Butter Cookies,Keto Diet,4.0,133,15 mins,25 mins,12 cookies,12,133,11g,12g,6g,7,4,12,1.0
"['1 (18 ounce) package Hawaiian sweet rolls', '2 cups shredded Cheddar cheese, divided', '1 pound ground beef', '1 small onion, chopped', '½ (14 ounce) can diced tomatoes with garlic and onion', '1 ½ teaspoons Dijon mustard', '1 ½ teaspoons Worcestershire sauce', '¼ teaspoon salt', '¼ teaspoon ground black pepper', '12  bacon strips, cooked and crumbled', '½ cup butter', '2 tablespoons brown sugar', '1 tablespoon Dijon mustard', '2 teaspoons Worcestershire sauce', '1 tablespoon sesame seeds']","['Preheat oven to 350 degrees F (175 degrees C). Grease a 9x13-inch baking pan.', 'Place rolls, without separating them, on a flat work surface. Cut in half horizontally. Arrange bottom half in the prepared pan. Sprinkle 1 cup Cheddar cheese on top.', 'Bake in the preheated oven until cheese is melted, 3 to 5 minutes.', 'Cook and stir beef and onion in a skillet until beef is browned, 5 to 8 minutes. Drain grease. Stir in tomatoes, 1 1/2 teaspoons Dijon mustard, 1 1/2 teaspoons Worcestershire sauce, salt, and pepper. Cook until fully combined, 1 to 2 minutes.', 'Spoon beef mixture over rolls. Sprinkle remaining 1 cup Cheddar cheese and bacon on top. Cover with top half of rolls.', 'Combine butter, brown sugar, 1 tablespoon Dijon mustard, and 2 teaspoons Worcestershire sauce in a microwave-safe bowl. Cover and microwave on high until butter is melted, about 1 minute. Stir until blended and pour over rolls. Sprinkle sesame seeds on top.', 'Bake in the preheated oven, uncovered, until golden brown, 20 to 25 minutes.']",5107051-2a8e9154336244f5b4747ca7dadef7d0.jpg,https://www.allrecipes.com/recipes/205/meat-and-poultry/pork/,Cheesy Bacon Slider Bake,Pork,4.7,12,30 mins,45 mins,12 servings,12,385,19g,28g,19g,14,15,12,1.0
"['6 (5-inch) corn tortillas', '3 cups chopped cooked chicken', '4 sprigs fresh cilantro, chopped', '½ cup chopped white onion', '1 cup guacamole', '1  lime, cut into wedges']","['Place a paper towel on a microwave-safe plate and top with tortillas; heat in the microwave for 10 seconds.', 'Place chicken in a microwave-safe bowl; heat in the microwave until heated through, 30 seconds to 1 minute.', 'Layer chicken, cilantro, onion, and guacamole, in that order, onto each tortilla. Squeeze lime juice over each taco.']",5414541-1e498b617cf84c479998b9903009a851.jpg,https://www.allrecipes.com/recipes/728/world-cuisine/latin-american/mexican/,Traditional Mexican Street Tacos,Mexican,4.4,9,0 mins,10 mins,6 tacos,2,697,30g,44g,64g,1,6,2,0.0
