ingredients,directions,image_filename,category_url,title,category,rating,rating_count,cook_time,total_time,yield,servings,calories,fat,carbs,protein,verb_count,ingredient_count,yield_servings_merge,like_or_dislike
"['1 pound lean ground beef', '2 tablespoons dried minced onion', '1 (12 ounce) bottle chili sauce (such as Heinz®)', '2 ½ tablespoons brown sugar', '1 tablespoon water, or as needed', '½ cup salted butter, softened, or as needed', '16 slices bread', '16 slices American cheese']","['Heat a large skillet over medium-high heat. Cook and stir ground beef and minced in the hot skillet until browned and crumbly, 5 to 7 minutes.', 'Add chili sauce and brown sugar. Rinse chili sauce jar with water to get the remnants of the sauce; add to the beef mixture. Stir, reduce heat, and simmer for 10 to 15 minutes. Remove from the heat.', 'Butter one side of 2 slices of bread. Place one slice, butter-side down, in a new skillet over medium heat. Layer with 1 slice of American cheese, a scoop of Sloppy Joe mixture, another slice of cheese, and the second piece of bread, butter-side up. Cook until sandwich is browned on the bottom and the bottom slice of cheese is melted, 3 to 5 minutes. Flip sandwich over and repeat on the other side. Repeat to assemble and cook remaining sandwiches.']",5410153-e9807f995fb74fe58bd2fcd56b541010.jpg,https://www.allrecipes.com/recipes/14930/main-dish/sandwiches/sloppy-joes/,Grilled Cheese Sloppy Joes,Sloppy Joes,4.8,4,1 hr,1 hr 10 mins,8 sandwiches,8,585,39g,32g,27g,13,8,8,1.0
"['1 cup butter', '1 cup packed brown sugar', '1 cup white sugar', '4  eggs', '2 teaspoons vanilla extract', '1 ½ cups all-purpose flour', '1 teaspoon baking powder', '½ teaspoon salt', '2 cups peeled and finely shredded yam', ""1 cup confectioners' sugar"", '2 tablespoons butter or margarine', '2 tablespoons milk']","['Preheat the oven to 350 degrees F (175 degrees C). Grease a 9x13 inch baking dish.', 'In a large bowl, cream together the butter, brown sugar, and white sugar until smooth. Beat in the eggs one at a time, then stir in the vanilla. Combine the flour, baking powder, and salt; stir into the batter just until blended. Fold in the shredded yam. Spread the batter evenly in the greased baking dish.', ""Bake for 30 minutes in the preheated oven, until a toothpick inserted into the center, comes out clean. Mix together the confectioners' sugar, butter and milk until smooth. Spread over the brownies while they are still warm. They will absorb some of the glaze. Serve hot or warm.""]",1059053-70a5c73ef725427e9770ad083c423e87.jpg,https://www.allrecipes.com/recipes/2452/fruits-and-vegetables/vegetables/yams/,Golden Yam Brownies,Yams,4.5,497,30 mins,1 hr,24 servings,24,221,10g,32g,2g,11,12,24,1.0
"['1 (14 ounce) can sweetened condensed milk (such as La Lechera®)', '½ cup white sugar (Optional)', '5  large eggs', '2 teaspoons vanilla extract', '2 (15.25 ounce) cans whole kernel corn, drained and rinsed', '1 (15 ounce) can cream-style corn', '½ cup butter, melted', '2 ½ cups cornmeal', '½ cup all-purpose flour', '1 tablespoon baking soda', '1 teaspoon salt']","['Preheat the oven to 350 degrees F (175 degrees C). Grease and flour a 2-quart baking dish.', 'Whisk sweetened condensed milk and sugar together in a large bowl. Whisk in eggs, and vanilla. Stir in whole kernel corn, cream-style corn, and butter.', 'Whisk cornmeal, flour, baking soda, and salt in a separate bowl; stir cornmeal mixture into the corn mixture.', 'Pour batter into the prepared baking dish.', 'Bake until a toothpick inserted into the center of the cornbread comes out clean, about 45 minutes. Serve warm.']",9281485-authentic-mexican-corn-bread-Lisa-Lodermeier-4x3-1-1a3f416bc27d475a93810ec146b95776.jpg,https://www.allrecipes.com/recipes/342/bread/quick-bread/cornbread/,Authentic Mexican Corn Bread,Cornbread,4.3,50,45 mins,1 hr,1 pan cornbread,12,448,14g,74g,11g,9,11,12,0.0
"['cooking spray', '½ cup milk', '½ cup all-purpose flour', '2  eggs, lightly beaten', '¼ teaspoon salt', '2 tablespoons butter, cut into 6 pieces', '½ cup grated sharp Cheddar cheese', '¼ cup brown sugar', '¼ teaspoon ground nutmeg', '1  pear, thinly sliced']","['Preheat oven to 400 degrees F (200 degrees C). Spray 6 custard cups with cooking spray.', 'Pour milk, flour, eggs, and salt in a bowl. Mix until batter is fully combined.', 'Place a piece of butter in each prepared cup. Sprinkle each cup with Cheddar cheese, brown sugar, and nutmeg; line each evenly with pear slices. Pour batter evenly into the prepared cups.', 'Bake in the preheated oven until golden brown, 15 to 20 minutes.']",5683850-2c7cb5085e914504a3727673a6e891ef.jpg,https://www.allrecipes.com/recipes/14912/bread/quick-bread/popovers-and-yorkshire-pudding/,Fancy Pear Popovers,Popovers And Yorkshire Pudding,3.8,4,15 mins,40 mins,6 popovers,6,201,10g,23g,7g,3,10,6,1.0
"['¼ teaspoon salt', '¾ cup warm water', '1 cup all-purpose flour', '¼ teaspoon vegetable oil (Optional)', '¼ cup all-purpose flour', '1 tablespoon vegetable oil (Optional)', '1 tablespoon Asian (toasted) sesame oil, or as needed', '½ cup finely chopped green onion', '1 tablespoon vegetable oil, or as needed (Optional)']","['Dissolve salt in warm water, and mix in 1 cup of flour to make a soft dough. Turn the dough out onto a well-floured work surface, and knead until slightly springy, about 5 minutes. If the dough is sticky, knead in 1/4 teaspoon of vegetable oil. Divide the dough into 8 equal-size pieces, and keep the pieces covered with a cloth.', 'In a bowl, mix 1/4 cup of flour with 1 tablespoon vegetable oil to make a mixture like fine crumbs.', 'On a floured work surface, roll a piece of dough out into a thin square about 5x7 inches in size, brush the dough with toasted sesame oil, and sprinkle lightly with about 1 1/2 teaspoon of the flour-oil mixture. Sprinkle about 1 tablespoon of chopped green onion onto the dough, and spread the onion out evenly. Starting with a long end, roll the dough up into a rope shape, and pinch the seam and the ends closed. Roll the rope shape into a flat spiral, and press lightly with your hands to compact the spiral and keep it from unrolling.', 'Place the spiral down onto the floured work surface, and gently roll it out into a pancake with the onions folded inside, turning the pancake over often as you roll it out. Roll gently and turn often to avoid making holes in the pancakes. Finished pancakes should be about 5 inches in diameter. Repeat with the rest of the dough pieces, making 8 onion pancakes.', 'Heat a non-stick skillet over medium heat, and brush with vegetable oil. Pan-fry each pancake in the hot skillet until golden brown on both sides, about 5 minutes per side. Cut into wedges and serve warm.']",3103210-pan-fried-chinese-pancakes-jessFu-4x3-1-371dd5c4e3ff4cbea21d44bea7e3472f.jpg,https://www.allrecipes.com/recipes/17668/holidays-and-events/lunar-new-year/,Pan-Fried Chinese Pancakes,Lunar New Year,3.8,25,40 mins,1 hr 10 mins,8 pancakes,8,120,6g,15g,2g,34,9,8,1.0
"['1 pound fresh, ground pork sausage', '1  onion, finely chopped', '1 cup chopped celery', '1  green bell pepper, chopped', '½ cup uncooked long-grain rice', '2 ½ cups hot water', '1 envelope chicken noodle mix -dry', '2 tablespoons sliced almonds']","['Preheat oven to 375 degrees F (190 degrees C).', 'In a Dutch-oven over medium heat, brown the sausage with the onion, celery and bell pepper; drain. Pour in rice, hot water, and soup mix. Stir until any lumps of soup have melted. Top with almonds. Cover and bake in a preheated oven for 1 1/2 hours.']",8026424-046a14e347a645d2a9a6f1a187b17595.jpg,https://www.allrecipes.com/recipes/1004/main-dish/casseroles/rice/,My Mom's Sausage and Rice Casserole,Rice,4.4,52,1 hr 30 mins,1 hr 55 mins,6 servings,6,414,32g,20g,12g,4,8,6,1.0
"[""9  Hawaiian bread rolls (such as King's®), split"", '1 (12 ounce) can fully cooked luncheon meat, teriyaki flavor (such as SPAM® Teriyaki)', '3  pineapple rings', '3 tablespoons sriracha hot sauce', '1 tablespoon lime juice']","[""Set oven rack about 6 inches from the heat source and preheat the oven's broiler or set a toaster oven to broil setting. Place rolls cut-side up in a single layer on a baking sheet."", 'Toast rolls in preheated oven until lightly brown, 1 to 3 minutes.', 'Slice luncheon meat lengthwise into nine 1/4-inch thick slices.', 'Heat a cast-iron or non-stick skillet over medium-high heat. Cook luncheon meat slices until lightly browned, about 1 minute per side; transfer to toasted roll bottoms. Cook pineapple rings in the same skillet until lightly browned, 1 1/2 to 2 minutes per side.', 'Spread sriracha evenly on each luncheon meat slice. Cut each pineapple ring into 3 pieces. Top each luncheon meat slice with 1 pineapple piece, sprinkle with lime juice, and cover with roll tops.']",3624309-e9bc2972996d41378b31f8cb8d006aec.jpg,https://www.allrecipes.com/recipes/17308/everyday-cooking/more-meal-ideas/mini-foods/main-dishes/sliders/,Spicy Teriyaki Spam® and Pineapple on a Hawaiian Roll,Sliders,5.0,1,6 mins,16 mins,9 sandwiches,9,402,10g,47g,19g,14,5,9,0.0
"['1 (6 ounce) can crabmeat, drained and flaked', '1 tablespoon sliced green onion', '¼ cup shredded Swiss cheese', '½ cup mayonnaise', '1 teaspoon lemon juice', '¼ teaspoon curry powder', '1 (8 ounce) package dinner rolls', '1 (5 ounce) can water chestnuts, drained and sliced']","['Preheat oven to 400 degrees F (200 degrees C).', 'In a medium bowl, mix together crabmeat, green onion, Swiss cheese, mayonnaise, lemon juice and curry powder.', 'Separate dinner rolls into 3 pieces each. Spoon equal portions of the crabmeat mixture onto the roll pieces. Top with water chestnuts.', 'Bake in the preheated oven 10 to 12 minutes, or until bubbly and golden brown.']",9418900-3b835184dc124dde9fe59c15f6c99f0f.jpg,https://www.allrecipes.com/recipes/17807/appetizers-and-snacks/tapas/,Crab Swiss Bites,Tapas,4.1,8,12 mins,22 mins,30 bites,10,114,10g,2g,4g,1,8,10,1.0
"['1 cup rolled oats', '1 cup steel-cut oats', '1 cup crispy rice cereal', '½ cup chopped mixed dried fruit', '½ cup chopped almonds', '¼ cup butter', '½ cup brown sugar', '¼ cup honey', '2 teaspoons vanilla extract', '½ cup mini chocolate chips']","['Grease a 9x13-inch baking dish.', 'Mix rolled oats, steel-cut oats, rice cereal, dried fruit, and almonds together in a large bowl.', 'Melt butter in a saucepan over medium heat; add brown sugar, honey, and vanilla. Whisk until sugar is completely dissolved, about 2 minutes. Pour over oat mixture; stir to combine.', 'Spread oat mixture into the prepared baking dish. Press chocolate chips into the top. Refrigerate until chilled, about 1 hour.', 'Sliced chilled granola mixture into 24 bars.']",1311093-489c6376634c40fa8b4e0bf3ca920176.jpg,https://www.allrecipes.com/recipes/1991/everyday-cooking/on-the-go/road-trip-snacks/,Chewy No-Bake Granola Bars,Road Trip Snacks,4.3,64,5 mins,1 hr 15 mins,2 dozen granola bars,24,119,5g,18g,2g,9,10,24,1.0
"['7 large eggs', '¼ cup heavy cream', '1 teaspoon smoked paprika', 'salt and freshly ground black pepper to taste', '2 tablespoons unsalted butter', '½ cup chopped onion', '1 ½ cups chopped fresh broccoli', '1 cup frozen diced hash brown potatoes, thawed', '1 cup shredded Cheddar cheese', '4 slices bacon, cooked and crumbled']","['Position a rack in the center of the oven and preheat the oven to 400 degrees F (200 degrees C).', 'Whisk eggs, cream, smoked paprika, salt, and pepper together in a bowl. Set aside.', 'Melt butter in a 12-inch nonstick, oven-proof skillet over medium-high heat until bubbly. Add chopped onion and cook until softened, 1 to 2 minutes. Add chopped broccoli and cook, stirring occasionally, about 2 minutes. Add potatoes and cook, stirring occasionally, about 2 minutes. Lightly season vegetables with additional salt and pepper.', 'Gently pat the vegetables into an even layer with the back of a spatula or spoon and turn off the heat. Sprinkle cheese over the vegetables, followed by bacon.', 'Pour the egg mixture into the skillet and gently shake to eliminate any holes around the vegetables. Let the residual heat cook the eggs slightly, about 2 minutes.', 'Bake in the preheated oven for 8 to 10 minutes. Check for doneness by using a knife to cut the center slightly. Eggs should not be runny enough to fill the cut. Allow to cool in the skillet for 5 minutes before serving.']",8600461-d95612ba846d457d9c2988dcc19a47ef.jpg,https://www.allrecipes.com/recipes/1564/breakfast-and-brunch/eggs/frittata/,Broccoli-Cheddar Frittata,Frittata,5.0,2,15 mins,40 mins,8 servings,8,179,15g,6g,8g,23,10,8,0.0
"['½ (8 ounce) package egg noodles', '1 (10.75 ounce) can  condensed cream of mushroom soup', '¾ cup whole milk', '1 (5 ounce) can tuna', '2 slices processed cheese food (such as Velveeta®)', '½ cup crushed potato chips, or as needed']","['Bring a large pot of lightly salted water to a boil. Cook egg noodles in the boiling water, stirring occasionally until cooked through but firm to the bite, about 5 minutes. Drain.', 'Preheat oven to 350 degrees F (175 degrees C).', 'Combine mushroom soup, milk, and tuna in a saucepan over medium heat; cook until well blended and warmed through, about 5 minutes. Pour mixture into a 9x13-inch baking dish; add noodles and mix well. Top noodles with cheese food and sprinkle potato chips over cheese.', 'Bake in the preheated oven until casserole is bubbling, 30 to 45 minutes.']",4536651-41c8a884b6844e25a63810cd77c2953c.jpg,https://www.allrecipes.com/recipes/15020/main-dish/casseroles/seafood/tuna/,Fern's Tuna Casserole,Tuna,4.5,39,40 mins,55 mins,4 servings,4,334,15g,33g,18g,9,6,4,1.0
"['2 tablespoons all-purpose flour', '1 teaspoon water, or as needed', '1 pound chicken livers, trimmed', '1 ¼ cups heavy whipping cream', '1  onion, quartered', '2  eggs', '2 tablespoons butter, melted', '1 teaspoon salt', '¼ teaspoon ground nutmeg', 'ground black pepper to taste']","['Preheat oven to 390 degrees F (200 degrees C).', 'Mix flour and water together in a bowl until a thin paste forms, adding more water as needed.', 'Combine flour mixture, chicken livers, cream, onion, eggs, butter, salt, nutmeg, and black pepper in a food processor; process until blended and smooth, 30 to 45 seconds.', 'Transfer liver mixture to three 7x4-inch disposable pans. Cover pans with aluminum foil and place in a baking pan. Pour enough water into the baking pan to come up halfway up the sides.', 'Bake in the preheated oven for 25 minutes. Remove foil and continue baking until cooked through, about 25 minutes. An instant-read thermometer inserted into the center should read at least 165 degrees F (74 degrees C). Cool to room temperature. Cover with lids and refrigerate.']",9339216-ba3552f7deb8454fbe0191fe6a8ff73d.jpg,https://www.allrecipes.com/recipes/435/appetizers-and-snacks/dips-and-spreads/pate/,Danish Chicken Liver Pate,Pate,5.0,2,50 mins,1 hr 15 mins,12 servings,12,168,14g,4g,8g,14,10,12,1.0
"['1 teaspoon olive oil', '1  shallot, finely diced', '1 cup balsamic vinegar', '2  skinless, boneless chicken breast halves', '2 ounces goat cheese, divided']","['Preheat oven to 350 degrees F (175 degrees C).', 'Heat olive oil in a skillet over medium heat; cook and stir shallot until translucent, about 5 minutes. Pour balsamic vinegar into skillet and bring to a boil. Reduce heat to low and simmer until balsamic vinegar mixture is reduced by half, about 10 minutes. Stir often.', 'Cut chicken breasts from one side through the middle horizontally to within one-half inch of the other side. Open the two sides and spread them out like an open book.', 'Spread half the goat cheese onto one half of each chicken breast and drizzle 1/3 of the reduced balsamic vinegar mixture over the goat cheese. Close the chicken breasts over the goat cheese and secure with toothpicks. Arrange chicken into a baking dish. Drizzle with remaining 1/3 of the balsamic reduction.', 'Bake in the preheated oven until the chicken is no longer pink inside, the filling is hot, and the juices run clear, 30 to 35 minutes. An instant-read meat thermometer inserted into the center of a filled breast should read at least 160 degrees F (70 degrees C).']",1120650-balsamic-goat-cheese-stuffed-chicken-breasts-mzlez-1x1-1-4a444df7a4314855a9b907e7efd7bb29.jpg,https://www.allrecipes.com/recipes/15050/everyday-cooking/cooking-for-one/,Balsamic Goat Cheese Stuffed Chicken Breasts,Cooking For One,4.5,111,30 mins,45 mins,2 servings,2,340,14g,24g,30g,17,5,2,1.0
"['6 pounds skin-on, bone-in chicken thighs', '2 teaspoons whole black peppercorns', '12 cloves garlic, smashed and peeled', '4  bay leaves', '½ cup soy sauce', '1 cup distilled white vinegar']","['Place chicken thighs, peppercorns, garlic, bay leaves, soy sauce, and vinegar into the bottom of a slow cooker in that order, making sure peppercorns and bay leaves are submerged into the liquid.', 'Cover and cook on High until chicken thighs are no longer pink in the centers, about 5 hours. An instant-read thermometer inserted near the bone of a thigh should read 165 degrees F (74 degrees C).']",7560738-b0c4cafa3cdc4463af2f9cd7bb6c109c.jpg,https://www.allrecipes.com/recipes/16519/main-dish/chicken/chicken-adobo/,Slow Cooker Filipino Chicken Adobo,Chicken Adobo,3.5,15,5 hrs,5 hrs 10 mins,8 servings,8,581,35g,3g,59g,9,6,8,1.0
"['2 teaspoons yeast', '2 tablespoons warm water', '1 ½ cups shredded part-skim mozzarella cheese', '1  large egg, lightly beaten', '1 cup blanched almond flour', '1 teaspoon xanthan gum', '⅛ teaspoon salt']","['Preheat the oven to 375 degrees F (190 degrees C). Line a baking sheet with parchment paper.', 'Dissolve yeast in warm water in a bowl. Set aside for about 5 minutes.', 'Place mozzarella cheese into a microwave-safe bowl. Microwave for 90 seconds, stirring every 30 seconds until cheese is completely melted. Stir in yeast mixture and egg and stir to combine; mixture will not incorporate well at this point.', 'Stir in almond flour, xanthan gum, and salt. If mixture is difficult to mix, reheat in the microwave for 20-30 seconds to soften the cheese. Stir again until well incorporated. Using your hands, knead the dough for 2 minutes.', 'Place dough on baking sheet and press with your fingers into a thin crust, approximately 11-12 inches in diameter.', 'Bake in the preheated oven until crust is lightly browned, about 10 minutes. Remove from oven, top with your favorite pizza toppings, and return to the oven for 5 minutes, or until cheese is melted.']",6578751-72797e20cd9f4b72ba6b1d9d9f364625.jpg,https://www.allrecipes.com/recipes/1035/bread/pizza-dough-and-crusts/,Thin-Crust Fathead Pizza Dough,Pizza Dough And Crusts,5.0,6,10 mins,30 mins,6 slices,6,212,16g,7g,13g,19,7,6,1.0
"['2  bay leaves', '1 teaspoon salt', '1 teaspoon ground cayenne pepper', '1 teaspoon ground black pepper', '½ teaspoon ground white pepper', '½ teaspoon ground cumin', '½ teaspoon ground nutmeg', '4 tablespoons butter', '¾ cup chopped onion', '½ cup chopped green bell pepper', '¼ cup chopped green onions', '4 cloves garlic, minced', '1 tablespoon hot pepper sauce', '1 tablespoon Worcestershire sauce', '½ cup evaporated milk', '½ cup ketchup', '1 ½ pounds ground beef', '½ pound andouille sausage, casings removed', '2  eggs, beaten', '1 cup dried bread crumbs']","['In a small bowl, combine the bay leaves, salt, cayenne pepper, ground black pepper, ground white pepper, cumin, and nutmeg; set aside.', 'Melt the butter or margarine in a saucepan over medium heat. Add the onion, bell pepper, green onions, garlic, hot pepper sauce, Worcestershire sauce, and reserved seasoning mix. Saute until mixture starts sticking to the bottom of the pan, about 6 minutes. Stir in the milk and ketchup; continue cooking for 2 more minutes, stirring occasionally.', 'Remove vegetable mixture from heat, and allow to cool to room temperature. Place the beef and sausage in an ungreased 9x13 inch baking dish. Add the eggs, the vegetable mixture, and the bread crumbs. Remove the bay leaves. Mix well by hand, and form into a loaf about 1 1/2 inches high.', 'Bake uncovered at 350 degrees F (175 degrees C) for 25 minutes. Then raise heat to 400 degrees F (200 degrees C) and bake for another 35 minutes. Let stand for 5 minutes before serving.']",373398-ea5b8d0d7c614f2eaffa5d28b04962d9.jpg,https://www.allrecipes.com/recipes/256/main-dish/meatloaf/,Cajun Style Meatloaf,Meatloaf,4.7,304,1 hr,1 hr 20 mins,6 to 8 servings,8,548,41g,19g,26g,25,20,8,1.0
"['1 (16.5 ounce) can pitted Bing cherries, drained, juice reserved', '1 (12 fluid ounce) can cola-flavored carbonated beverage', '1 (6 ounce) package black cherry flavored Jell-O® mix', '1 (15.25 ounce) can crushed pineapple, drained', '1 cup chopped pecans']","['In a saucepan, combine the reserved cherry juice with the cola. Bring to a boil, and stir in the gelatin until dissolved. Remove from the heat, and mix in the drained cherries, drained pineapple, and chopped pecans. Pour mixture into a mold sprayed with non-stick cooking spray, and refrigerate for at least 24 hours before serving.']",928142-a5f907b3e77d4af4a891e22accab54bb.jpg,https://www.allrecipes.com/recipes/980/desserts/specialty-desserts/dessert-salads/jell-o-salad/,Bing Cherry Gelatin Mold,Jell O Salad,4.3,45,10 mins,1 day 15 mins,8 servings,8,253,10g,41g,4g,9,5,8,1.0
"['1 tablespoon olive oil', '1  chayote squash, cut into 1/2-inch strips', '1 clove garlic, minced', '½ teaspoon salt, or as needed', '½ teaspoon white sugar, or as needed', '¼ teaspoon red pepper flakes (Optional)', 'ground black pepper to taste', '1 tablespoon red wine vinegar']","['Heat olive oil in a medium skillet over medium-high heat. Cook and stir squash, garlic, salt, sugar, red pepper flakes, and black pepper in hot oil for 2 to 3 minutes.', 'Pour in vinegar; cook and stir until squash is slightly wilted but still firm and crunchy, 2 to 3 minutes.']",6873458-a1a61d749f8640f0ab20ec151a428912.jpg,https://www.allrecipes.com/recipes/192/holidays-and-events/mardi-gras/,Chayote Squash Side Dish,Mardi Gras,4.2,97,5 mins,20 mins,2 cups,2,90,7g,7g,1g,2,8,2,1.0
"['2 cups fresh blueberries', '½ cup white sugar', '2 tablespoons all-purpose flour', '2 tablespoons grated lemon zest', '1 cup white sugar', '1/2 cup unsalted butter, softened', '3 large eggs', '1 tablespoon grated lemon zest', '1 teaspoon almond extract', '2 cups all-purpose flour', '4 teaspoons baking powder', '3/4 cup milk', '1/2 cup slivered almonds, toasted']","['Preheat the oven to 350 degrees F (175 degrees C). Grease and flour a 9-inch springform pan.', 'Make the topping: Combine blueberries, sugar, flour, and lemon zest in a bowl. Toss until blueberries are coated, then pour into the prepared pan.', 'Make the cake: Cream sugar and butter in a large bowl with an electric mixer until light and fluffy. Beat in eggs, one at a time, then stir in lemon zest and almond extract.', 'Stir flour and baking powder together in a small bowl; beat into butter mixture alternately with milk, mixing just until incorporated. Pour cake batter over blueberries in the pan.', 'Bake in the preheated oven until a toothpick inserted into the center of the cake comes out clean, 60 to 70 minutes. Place a serving plate over the top of the pan and carefully invert the cake and plate together so the berries end up on top. Carefully unlock the buckle on the side of the pan and remove. Sprinkle toasted almonds on top of the cake and serve warm.']",8363519-87ce7aa5e59846d0b878075178087fd8.jpg,https://www.allrecipes.com/recipes/11980/desserts/cakes/upside-down-cake/,Blueberry Upside-Down Cake,Upside Down Cake,4.2,41,1 hr,1 hr 40 mins,1 9-inch cake,10,374,14g,57g,7g,19,13,10,1.0
"['4 tablespoons all-purpose flour', '1 ½ tablespoons Italian seasoning', '1 ½ tablespoons onion powder', '½ teaspoon salt', '½ teaspoon ground black pepper', '1 ½ pounds beef stew meat, cubed', '2 ¾ cups beef broth', '1 cup dry red wine', '2 tablespoons tomato paste', '3 cloves garlic, minced', '1 cup chopped red potatoes', '1 medium white onion, quartered', '½ cup chopped carrots', '½ cup chopped celery', '2 sprigs fresh rosemary', '1  bay leaf', '½ (8 ounce) package egg noodles']","['Combine flour, Italian seasoning, onion powder, salt, and pepper in a gallon-sized resealable plastic bag. Shake to mix seasoning. Add beef to bag, seal, and shake to coat.', ""Select Sear function on a multi-functional electric pressure cooker (such as Instant Pot) according to manufacturer's instructions. Add coated beef cubes and sear until lightly browned on all sides, 7 to 10 minutes. Pour in broth and red wine. Add tomato paste and garlic. Stir in potatoes, onion, carrots, celery, rosemary, and bay leaf."", 'Close and lock the lid. Select Stew setting and set timer for 25 minutes. Allow 10 to 15 minutes for pressure to build.', ""Release pressure using the natural-release method according to manufacturer's instructions, 10 to 40 minutes."", 'Meanwhile, fill a large pot with lightly salted water and bring to a rapid boil. Cook egg noodles at a boil until tender yet firm to the bite, 7 to 9 minutes. Serve alongside beef stew.']",7698466-63b69c4675eb421a913b7b109312deea.jpg,https://www.allrecipes.com/recipes/14730/soups-stews-and-chili/stews/beef/,Instant Pot Beef Stew with Red Wine,Beef,4.1,7,45 mins,1 hr 15 mins,4 servings,4,594,25g,44g,37g,19,17,4,1.0
